category,quote
motivation,I am capable of achieving anything I set my mind to.
motivation,"I am focused, persistent, and determined."
motivation,I am confident in my ability to overcome challenges.
motivation,I am growing stronger and wiser every day.
motivation,I am resilient and can handle whatever comes my way.
motivation,I am motivated to create the life I dream of.
motivation,I am constantly improving and learning new things.
motivation,I am proud of how far I’ve come and excited for what’s ahead.
motivation,I am unstoppable when I believe in myself.
motivation,I am worthy of success and happiness.
motivation,"I am disciplined, driven, and focused on my goals."
motivation,I am brave enough to take the first step.
motivation,I am the author of my own success story.
motivation,I am persistent even when things get tough.
motivation,I am grateful for the opportunities that help me grow.
motivation,I am aligned with my purpose and passion.
motivation,I am capable of turning my dreams into reality.
motivation,I am not afraid of failure; I learn and rise stronger.
motivation,I am creating momentum toward my goals every day.
motivation,I am open to new possibilities and confident in my path.
motivation,I am full of potential waiting to shine.
motivation,I am proud of the effort I give each day.
motivation,I am capable of handling whatever the day brings.
motivation,I am courageous enough to chase my biggest dreams.
motivation,I am committed to becoming my best self.
self love,I am enough just as I am.
self love,"I am worthy of love, kindness, and respect."
self love,I am proud of who I am becoming.
self love,I am deserving of good things in life.
self love,I am learning to love myself unconditionally.
self love,I am gentle with myself as I grow and heal.
self love,"I am grateful for my body, my mind, and my spirit."
self love,I am comfortable in my own skin.
self love,"I am a work in progress, and that’s okay."
self love,I am allowed to take up space and shine brightly.
self love,I am surrounded by love and positivity.
self love,"I am proud of my journey, even the tough parts."
self love,I am kind to myself and speak to myself with love.
self love,I am at peace with who I am and where I am.
self love,I am grateful for the unique light I bring to the world.
self love,I am healing and growing at my own pace.
self love,I am allowed to rest without guilt.
self love,"I am beautiful, strong, and full of potential."
self love,I am free from self-doubt and open to self-acceptance.
self love,I am deserving of happiness and joy.
self love,"I am proud of my progress, no matter how small."
self love,"I am calm, centered, and grounded in love."
self love,I am the source of my own happiness.
self love,I am worthy of my own compassion.
self love,"I am a masterpiece, perfectly imperfect."
